artist,original_songname,songname
Ozzy Osbourne,Here For You,Here for You
Ozzy Osbourne,Killer Of Giants,Killer of Giants
Ozzy Osbourne,Lay Your World On Me,Lay Your World on Me
Ozzy Osbourne,Love To Hate,Love to Hate
Ozzy Osbourne,Old L.A. Tonight,Old LA Tonight
Ozzy Osbourne,Over The Mountain,Over the Mountain
Ozzy Osbourne,Party With The Animals,Party with the Animals
Ozzy Osbourne,Road To Nowhere,Road to Nowhere
Ozzy Osbourne,See You On The Other Side,See You on the Other Side
Ozzy Osbourne,Sympathy For The Devil,Sympathy for the Devil
Ozzy Osbourne,Thank God For The Bomb,Thank God for the Bomb
Ozzy Osbourne,Waiting For Darkness,Waiting for Darkness
Passenger,Divers And Submarines,Divers & Submarines
Passenger,Needle In The Dark,Needle in the Dark
Passenger,All The Little Lights,All the Little Lights
Passenger,Staring At The Stars,Staring At the Stars
Pat Benatar,Payin' The Cost To Be The Boss,Payin' The Cost To Be Boss
Pat Benatar,Take It Anyway You Want It,Take It Any Way You Want It
Patsy Cline,A Poor Man's Roses,Poor Man's Roses
Patsy Cline,Sweet Dreams Of You,Sweet Dreams (Of You)
Patsy Cline,Foolin' Around,Foolin' 'Round
Patsy Cline,Honky Tonk Merry Go Round,Honky Tonk Merry Go Around
Patsy Cline,I Don't Wanna,I Don't Wanta
Patsy Cline,"I Love You, Honey",I Love You Honey
Patsy Cline,Just Out Of Reach,Just out of Reach
Patti Smith,Lo And Beholden,Lo and Beholden
Patti Smith,Pissing In A River,Pissing In a River
Patti Smith,So You Want To Be,So You Want to Be
Patti Smith,The Boy In The Bubble,The Boy in the Bubble
Patti Smith,25Th Floor,25th Floor
Patti Smith,About A Boy,About a Boy
Patti Smith,After The Gold Rush,After the Gold Rush
Patti Smith,Because The Night,Because the Night
Patti Smith,Beneath The Southern Cross,Beneath the Southern Cross
Patti Smith,Changing Of The Guards,Changing of the Guards
Patti Smith,Dream Of Life,Dream of Life
Patti Smith,Everybody Wants To Rule The World,Everybody Wants to Rule the World
Patti Smith,Stride Of The Mind,Stride of the Mind
Patti Smith,This Is The Girl,This Is the Girl
Patti Smith,Trespassers,Trespasses
Paul McCartney,C'mon People,C'Mon People
Paul McCartney,Certain Softness,A Certain Softness
Paul Simon,Bridge Over Troubled Waters,Bridge Over Troubled Water
Paul Simon,Everything About It Is A Love Song,Everything About It Is a Love Song
Paul Simon,Father And Daughter,Father and Daughter
Paul Simon,Further To Fly,Further to Fly
Paul Simon,How Can You Live In The Northeast,How Can You Live in the Northeast?
Paul Simon,Late In The Evening,Late in the Evening
Paul Simon,Look At That,Look at That
Paul Simon,Mother And Child Reunion,Mother and Child Reunion
Paul Simon,"Pigs, Sheep And Wolves","Pigs, Sheep and Wolves"
Paul Simon,Song About The Moon,Song About the Moon
Paul Simon,Trailway Bus,Trailways Bus
Paul Simon,Train In The Distance,Train in the Distance
Paul Simon,Was A Sunny Day,Was a Sunny Day
Paul Simon,You're The One,You're the One
Paul Simon,50 Ways To Leave Your Lover,50 Ways to Leave Your Lover
Paul Simon,Born At The Right Time,Born at the Right Time
Paul Simon,Born In Puerto Rico,Born in Puerto Rico
Paul Simon,"Crazy Love, Vol II","Crazy Love, Vol. II"
Paul Simon,Diamonds On The Soles Of Her Shoes,Diamonds on the Soles of Her Shoes
Paul Simon,Flowers Never Bend With The Rainfall,Flowers Never Bend with the Rainfall
Paul Simon,Getting Ready For Christmas Day,Getting Ready for Christmas Day
Paul Simon,God Bless The Absentee,God Bless the Absentee
Paul Simon,Gone At Last,Gone at Last
Paul Simon,How The Heart Approaches What It Yearns,How the Heart Approaches What It Yearns
Paul Simon,Killer Wants To Go To College Ii,Killer Wants to Go to College II
Paul Simon,Learn How To Fall,Learn How to Fall
Paul Simon,Love And Hard Times,Love and Hard Times
Paul Simon,Loves Me Like A Rock,Loves Me Like a Rock
Paul Simon,Me And Julio Down By The Schoolyard,Me and Julio Down by the Schoolyard
Paul Simon,Once Upon A Time There Was An Ocean,Once Upon a Time There Was an Ocean
Paul Simon,Peace Like A River,Peace Like a River
Paul Simon,Questions For The Angels,Questions for the Angels
Paul Simon,So Beautiful Or So What,So Beautiful or so What
Paul Simon,Some Folks Lives Roll Easy,Some Folks' Lives Roll Easy
Paul Simon,Take Me To The Mardi Gras,Take Me to the Mardi Gras
Paul Simon,That's Why God Made The Movies,That's Why God Made the Movies
Paul Simon,The Boy In The Bubble,The Boy In the Bubble
Paul Simon,The Side Of A Hill,The Side of a Hill
Pearl Jam,All Or None,All or None
Pearl Jam,Bushleaguer,Bu$hleaguer
Pearl Jam,Just A Girl,Just a Girl
Pearl Jam,Love Reign O'er Me,"Love, Reign O'er Me"
Pearl Jam,Out Of My Mind,Out of My Mind
Pearl Jam,Sleight Of Hand,Sleight of Hand
Pearl Jam,Soldier Of Love,Soldier of Love
Pearl Jam,Around The Bend,Around the Bend
Pearl Jam,Brain Of J.,Brain of J.
Pearl Jam,Don't Believe In Christmas,Don't Believe in Christmas
Pearl Jam,Given To Fly,Given to Fly
Pearl Jam,I Believe In Miracles,I Believe in Miracles
Pearl Jam,Of The Girl,Of the Girl
Perry Como,"A Hatchet, A Hammer, A Bucket Of Nails","A Hatchet, a Hammer, a Bucket of Nails"
Perry Como,Accentuate The Positive,Accentuate the Positive
Perry Como,Birth Of The Blues,Birth of the Blues
Perry Como,Do You Hear What I Hear ?,Do You Hear What I Hear
Perry Como,Dream On Little Dreamer,"Dream On, Little Dreamer"
Perry Como,Hoop Dee-Doo,Hoop-Dee-Doo
Perry Como,Just Out Of Reach,Just Out of Reach
Perry Como,Little Man You've Had A Busy Day,Little Man You've Had a Busy Day
Perry Como,Between The Devil And The Deep Blue Sea,Between the Devil and the Deep Blue Sea
Perry Como,Come Rain Or Come Shine,Come Rain or Come Shine
Perry Como,For The Good Times,For the Good Times
Perry Como,Give Myself A Party,Give Myself a Party
Perry Como,"Goodnight, Sweet Jesus","Good Night, Sweet Jesus"
Perry Como,Have Yourself A Merry Little Christmas,Have Yourself a Merry Little Christmas
Perry Como,It Could Happen To You,It Could Happen to You
Pet Shop Boys,Beautiful People,Beautiful people
Pet Shop Boys,Breathing Space,Breathing space
Pet Shop Boys,Building A Wall,Building a wall
Pet Shop Boys,Closer To Heaven 2,Closer To Heaven
Pet Shop Boys,Ego Music,Ego music
Pet Shop Boys,Everything Means Something,Everything means something
Pet Shop Boys,Hold On,Hold on
Pet Shop Boys,Home And Dry,Home and Dry
Pet Shop Boys,Happiness Is An Option,Happiness Is an Option
Pet Shop Boys,It Always Comes As A Surprise,It Always Comes as a Surprise
Pet Shop Boys,King Of Rome,King of Rome
Pet Shop Boys,Love Etc.,Love etc.
Pet Shop Boys,Love Is A Catastrophe,Love Is a Catastrophe
Pet Shop Boys,Memory Of The Future,Memory of the future
Pet Shop Boys,Requiem In Denim And Leopardskin,Requiem in denim and leopardskin
Pet Shop Boys,The Night I Fell In Love,The Night I Fell in Love
Pet Shop Boys,"Yesterday, When I Was Mad",Yesterday When I Was Mad
Peter Cetera,And I Think Of You,And I Think of You
Peter Cetera,The End Of Camelot,The End of Camelot
Peter Cetera,They Don't Make 'em Like They Used To,They Don't Make 'Em Like They Used To
Peter Cetera,Wake Up To Love,Wake up to Love
Peter Cetera,Apple Of Your Daddy's Eye,Apple of Your Daddy's Eye
Peter Cetera,Baby What A Big Surprise,Baby What a Big Surprise
Peter Cetera,Best Of Times,Best of Times
Peter Cetera,Even A Fool Can See,Even a Fool Can See
Peter Cetera,God Rest You Merry Gentlemen,God Rest Ye Merry Gentlemen
Peter Cetera,Have You Ever Been In Love?,Have You Ever Been in Love
Peter Cetera,Livin' In The Limelight,Livin' In the Limelight
Peter Cetera,Man In Me,Man in Me
Peter Cetera,Not Afraid To Cry,Not Afraid to Cry
Peter Cetera,On The Line,On the Line
Peter Cetera,Peace Of Mind,Peace of Mind
Peter Cetera,Queen Of The Masquerade Ball,Queen of the Masquerade Ball
Peter Cetera,Santa Claus Is Coming ToTown,Santa Claus Is Coming To Town
Peter Cetera,You Never Listen To Me,You Never Listen to Me
Peter Cetera,You're The Inspiration,You're the Inspiration
Peter Gabriel,The Story Of Ovo,The Story Of OVO
Peter Gabriel,...And Through The Wire,And Through The Wire
Peter Gabriel,Nocturnals,Nocturnal
Peter Tosh,Reggae Mylitis,Reggaemylitis
Peter Tosh,Steppin' Razor,Stepping Razor
Peter Tosh,Watcha Gonna Do,Whatcha Gonna Do
Pharrell Williams,Freedom!,Freedom
Pharrell Williams,Gust Of Wind,Gust of Wind
Phil Collins,Another Day In Paradise,Another Day in Paradise
Phil Collins,Both Sides Of The Story,Both Sides of the Story
Phil Collins,Come With Me,Come with Me
Phil Collins,For A Friend,For a Friend
Phil Collins,Hang In Long Enough,Hang in Long Enough
Phil Collins,(Love Is Like A) Heat Wave,(Love Is Like A) Heatwave
Phil Collins,Something Happened On The Way To Heaven,Something Happened On the Way to Heaven
Phil Collins,The Man With The Horn,The Man with the Horn
Phil Collins,I Like The Way,I Like the Way
Phil Collins,In The Air Tonight,In the Air Tonight
Phineas And Ferb,Christmas is Starting Now,Christmas Is Starting Now
Phineas And Ferb,Back In Gimmelshtump,Back in Gimmelshtump
Phineas And Ferb,Everything's Better With Perry,Everything's Better with Perry
Phineas And Ferb,"Let It Snow, Let It Snow, Let It Snow","Let it Snow, Let it Snow, Let it Snow"
Phineas And Ferb,Summer (Where Do We Begin),Summer (Where Do We Begin?)
Phineas And Ferb,Whatcha' Doin'?,Whatcha Doin'?
Phineas And Ferb,Where Did We Go Wrong,Where Did We Go Wrong?
Phish,No2,NO2
Phish,Scents And Subtle Sounds,Scents and Subtle Sounds
Phish,Spread It 'round,Spread It 'Round
Phish,Suzie Greenberg,Suzy Greenberg
Phish,Anything But Me,Anything but Me
Phish,Axilla Ii,Axilla I
Phish,I Saw It Again,Saw It Again
Phish,My Mind's Got A Mind Of It's Own,My Mind's Got A Mind Of Its Own
Phish,Pebbles And Marbles,Pebbles and Marbles
Phish,Scents And Subtle Sounds (Intro),Scents and Subtle Sounds (Intro)
Pink Floyd,A Pillow Of Winds,A Pillow of Winds
Pink Floyd,Coming Back To Life,Coming Back to Life
Pink Floyd,In The Flesh?,In the Flesh?
Pink Floyd,Learning To Fly,Learning to Fly
Pink Floyd,On The Turning Away,On the Turning Away
Pink Floyd,Remember A Day,Remember a Day
Pink Floyd,What Do You Want From Me,What Do You Want from Me
Pink Floyd,A Great Day For Freedom,A Great Day for Freedom
Pink Floyd,Green Is The Colour,Green is the Colour
Pink Floyd,Lost For Words,Lost for Words
Pink Floyd,One Of My Turns,One of My Turns
Pink Floyd,See Saw,See-Saw
Pink Floyd,Set The Controls For The Heart Of The Sun,Set the Controls for the Heart of the Sun
Pink Floyd,Take Up Thy Stethoscope And Walk,Take Up Thy Stethoscope and Walk
Pink Floyd,The Dogs Of War,The Dogs of War
Pink Floyd,The Gold It's In The....,The Gold It's in the...
Pink Floyd,The Gunners Dream,The Gunner's Dream
Pink Floyd,Two Suns In The Sunset,Two Suns in the Sunset
Pink Floyd,Us And Them,Us and Them
Pink Floyd,Wearing The Inside Out,Wearing the Inside Out
Pink Floyd,Welcome To The Machine,Welcome to the Machine
Pink Floyd,When The Tigers Broke Free,When the Tigers Broke Free
Pitbull,I Know You Want Me,I Konow You Want Me
Pitbull,Something For The DJ's,Something For The DJs
Planetshakers,Beautiful Savior,Beautiful Saviour
Planetshakers,Dont Pass Me By,Don't Pass Me By
P!nk,Get The Party Started,Get the Party Started
P!nk,Humble Neighborhood,Humble Neighborhoods
P!nk,Just Like A Pill,Just Like a Pill
P!nk,Love Is Such A Crazy Thing,Love Is Such a Crazy Thing
P!nk,Walk Of Shame,Walk of Shame
P!nk,Glitter In The Air,Glitter In the Air
P!nk,God Is A Dj,God Is A DJ
P!nk,Gone To California,Gone to California
P!nk,Long Way To Happy,Long Way to Happy
Pogues,A Rainy Night In Soho,A Rainy Night in Soho
Pogues,Dark Streets Of London,Dark Streets of London
Pogues,Down In The Ground Where The Dead Men Go,Down in the Ground Where the Deadmen Go
Pogues,Honky Tonk Woman,Honky Tonk Women
Pogues,House Of The Gods,House of the Gods
Pogues,If I Should Fall From Grace With God,If I Should Fall from Grace with God
Pogues,I'm A Man You Don't Meet Everyday,I'm a Man You Don't Meet Every Day
Pogues,Night Train To Lorca,Night Train to Lorca
Pogues,Once Upon A Time,Once Upon a Time
Pogues,The Sun And The Moon,The Sun and the Moon
Pogues,The Wake Of The Medusa,The Wake of the Medusa
Pogues,A Pair Of Brown Eyes,A Pair of Brown Eyes
Pogues,Bottle Of Smoke,Bottle of Smoke
Pogues,Boys From The County Hell,Boys from the County Hell
Pogues,Curse Of Love,Curse of Love
Pogues,Down All The Days,Down All the Days
Pogues,Fairytale Of New York,Fairytale of New York
Pogues,Five Green Queens And Jean,Five Green Queens and Jean
Pogues,Four O'clock In The Morning,Four O'Clock in the Morning
Pogues,Girl From The Wadi Hammamat,Girl from the Wadi Hammamat
Pogues,Living In A World Without Her,Living in a World Without Her
Pogues,London You're A Lady,London You're a Lady
Pogues,Love You 'till The End,Love You 'Till the End
Pogues,Lullaby Of London,Lullaby of London
Pogues,Paris St. Germain,Paris St. Germaine
Pogues,Sally Maclennane,Sally MacLennane
Pogues,Sit Down By The Fire,Sit Down by the Fire
Pogues,Sitting On Top Of The World,Sitting on Top of the World
Pogues,Six To Go,Six to Go
Pogues,Smell Of Petroleum,Smell of Petroleum
Pogues,Streams Of Whiskey,Streams of Whiskey
Pogues,The Body Of An American,The Body of an American
Pogues,The Leaving Of Liverpool,The Leaving of Liverpool
Pogues,The Sick Bed Of Cuchulainn,The Sick Bed of Cuchulainn
Pogues,The Sunnyside Of The Street,The Sunnyside of the Street
Pogues,Turkish Song Of The Damned,Turkish Song of the Damned
Pogues,When The Ship Comes In,When the Ship Comes In
Pogues,Whiskey In The Jar,Whiskey In the Jar
Pogues,"Whiskey, You're The Devil",Whiskey You're the Devil
Pogues,Young Ned Of The Hill,Young Ned of the Hill
Point Of Grace,Chalk In The Rain,Chalk In the Rain
Point Of Grace,Forever On And On,Forever On and On
Point Of Grace,He's The Best Thing,He's the Best Thing
Point Of Grace,Living The Legacy,Living the Legacy
Point Of Grace,Not That Far From Bethlehem,Not That Far from Bethlehem
Point Of Grace,Santa Claus Is Coming To Town,Santa Claus Is Coming to Town
Point Of Grace,That's The Way It's Meant To Be,That's the Way It's Meant to Be
Point Of Grace,You Are The Answer,You Are the Answer
Point Of Grace,A Good Place To Turn Around,A Good Place to Turn Around
Point Of Grace,All The World,All the World
Point Of Grace,Circle Of Friends,Circle of Friends
Point Of Grace,Dying To Reach You,Dying to Reach You
Point Of Grace,Got To Be Time,Got to Be Time
Point Of Grace,Keep The Candle Burning,Keep the Candle Burning
Point Of Grace,King Of The World,King of the World
Point Of Grace,Labor Of Love,Labor of Love
Point Of Grace,Light Of The World,Light of the World
Point Of Grace,Love And Laundry,Love and Laundry
Point Of Grace,The Giver And The Gift,The Giver and the Gift
Point Of Grace,The Love He Has For You,The Love He Has for You
Point Of Grace,The Love Of Christ,The Love of Christ
Point Of Grace,There's Nothing Greater Than Grace,There Is Nothing Greater Than Grace
Point Of Grace,Trust In The Lord,Trust In the Lord
Point Of Grace,Waiting In The Wings,Waiting In the Wing
Point Of Grace,Without The Love Of Jesus,Without the Love of Jesus
Poison,Get 'ya Some,Get 'Ya Some
Poison,Want Some Need Some,"Want Some, Need Some"
Poison,Doin' As I See On My Tv,Doin' As I Seen On My TV
Poison,Emperors's New Clothes,Emperor's New Clothes
Poison,Home ( Bret's Story),Home (Bret's Story)
Poison,Power To The People,Power to the People
Pretenders,From The Heart Down,From the Heart Down
Pretenders,How Much Did You Get For Your Soul?,How Much Did You Get for Your Soul?
Pretenders,Hymn To Her,Hymn to Her
Pretenders,I Go To Sleep,I Go to Sleep
Pretenders,I'm A Mother,I'm a Mother
Pretenders,Let's Make A Pact,Let's Make a Pact
Pretenders,Nails In The Road,Nails in the Road
Pretenders,Room Full Of Mirrors,Room Full of Mirrors
Pretenders,Sense Of Purpose,Sense of Purpose
Pretenders,Birds Of Paradise,Birds of Paradise
Pretenders,Dance!,Dance
Pretenders,Light Of The Moon,Light of the Moon
Pretenders,Message Of Love,Message of Love
Pretenders,Night In My Veins,Night in My Veins
Pretenders,Thin Line Between Love And Hate,Thin Line Between Love and Hate
Pretenders,Time The Avenger,Time the Avenger
Pretenders,Tradition Of Love,Tradition of Love
Pretenders,Watching The Clothes,Watching the Clothes
Pretenders,When Will I See You?,When Will I See You
Primus,Dutchess And The Proverbial Mind Spread,Duchess And The Proverbial Mind Spread
Primus,Jilly's On Smack,Jilly's on Smack
Primus,The Last Superpower Aka Rapscallion,The Last Superpower aka Rapscallion
Primus,Those Damn Blue Collar Tweekers,Those Damned Blue-Collar Tweekers
Primus,Tragedy's A' Comin,Tragedy's A' Comin'
Primus,Spaghetti Western,Spegetti Western
Prince,A Case Of U,A Case of U
Prince,All The Critics Love U In New York,All the Critics Love U in New York
Prince,Get Off,Gett Off
Prince,God,Gold
Prince,2045 Radical Man,2045: Radical Man
Prince,All The Midnights In The World,All the Midnights In the World
Prince,Baby I'm A Star,Baby I'm a Star
Prince,"Beautiful, Loved And Blessed","Beautiful, Loved and Blessed"
Prince,Circle Of Amour,Circle of Amour
Prince,Condition Of The Heart,Condition of the Heart
Prince,Diamonds And Pearls,Diamonds and Pearls
Prince,Dinner With Delores,Dinner with Delores
Prince,Elephants And Flowers,Elephants & Flowers
Proclaimers,I'm On My Way,I'm on My Way
Proclaimers,A Land Fit For Zeros,A Land Fit for Zeros
Proclaimers,Cap In Hand,Cap in Hand
Proclaimers,Come On Nature,Come on Nature
Proclaimers,Don't Give It To Me,Don't Give It to Me
Proclaimers,Don't Turn Out Like Your Mother,Don't Turn out Like Your Mother
Proclaimers,Everybody's A Victim,Everybody's a Victim
Proclaimers,Follow The Money,Follow the Money
Proclaimers,Hit The Highway,Hit the Highway
Proclaimers,I'm Gonna Be 500 Miles,I'm Gonna Be (500 Miles)
Proclaimers,Letter From America,Letter from America
Proclaimers,My Old Friend The Blues,My Old Friends the Blues
Proclaimers,Now And Then,Now and Then
Proclaimers,Over And Done With,Over and Done With
Proclaimers,Sky Takes The Soul,Sky Takes the Soul
Proclaimers,Sunshine On Leith,Sunshine on Leith
Proclaimers,There's A Touch,There's a Touch
Proclaimers,These Arms Of Mine,These Arms of Mine
Proclaimers,Throw The 'r' Away,Throw the 'R' Away
Proclaimers,What Do You Do?,What Do You Do
Proclaimers,What Makes You Cry?,What Makes You Cry
Proclaimers,When You're In Love,When You're in Love
Procol Harum,As Strong As Samson,As Strong as Samson
Procol Harum,Skating On Thin Ice,Skating on Thin Ice
Procol Harum,A Whiter Shade Of Pale,A Whiter Shade of Pale
Procol Harum,About To Die,About to Die
Procol Harum,Beyond The Pale,Beyond the Pale
Procol Harum,Cerdes (Outside The Gates Of),Cerdes (Outside the Gates Of)
Procol Harum,Eight Days A Week,Eight Days a Week
Procol Harum,Nothing But The Truth,Nothing but the Truth
Procol Harum,Playmate Of The Mouth,Playmate of the Month
Procol Harum,She Wandered Through The Garden Fence,She Wandered Through the Garden Fence
Procol Harum,Something Following Me,Something Followed Me
Procol Harum,Taking The Time,Taking the Time
Procol Harum,The Hand That Rock The Cradle,The Hand That Rocks The Cradle
Procol Harum,The Mark Of The Claw,The Mark of the Claw
Procol Harum,The Thin End Of The Wedge,The Thin End of the Wedge
Procol Harum,Whiskey Train,Whisky Train
Procol Harum,Without A Doubt,Without a Doubt
Puff Daddy,Diddy Speaks! (Interlude),Diddy Speaks (Interlude)
Puff Daddy,I Need A Girl (To Bella),I Need a Girl (To Bella)
Puff Daddy,The Saga Continues...,The Saga Continues
Qntal,Ab Vox D'Angel,Ab Vox d' Angel
Qntal,Ad Mortem Festinamus,Ad mortem festinamus
Qntal,Unter Der Linden,Unter der linden
Qntal,Palestinalied,Palastinalied
Quarashi,Stick 'em Up,Stick 'Em Up
Queen,Modern Times Rock'n'Roll,Modern Times Rock 'n' Roll
Queen,One Year Of Live,One Year Of Love
Queen,Still Burning,Still Burnin'
Queen,Surf's Up... School's Out,Surf's Up...School's Out
Queen,Get Down Make Love,"Get Down, Make Love"
Queen,Is This The World We Created?,Is This The World We Created
Queen,Machine's (Back To Humans),Machines (Back To Humans)
Queen,The Fairy Feller's Master Stroke,The Fairy Feller's Master-Stroke
Queen Adreena,Are The Songs My Disease?,Are the Songs My Disease?
Queen Adreena,Hide From Time,Hide from Time
Queen Latifah,A King And Queen Creation,A King and Queen Creation
Queen Latifah,California Dreamin,California Dreamin'
Queen Latifah,Dance For Me,Dance for Me
Queen Latifah,Evil That Men Do,Evil that Men Do
Queen Latifah,Princess Of The Posse,Princess of the Possee
Queen Latifah,Queen Of Royal Badness,Queen of Royal Badness
Queen Latifah,Wrath Of My Madness,Wrath of My Madness
Queens Of The Stone Age,I Was A Teenage Hand Model,I Was a Teenage Hand Model
Queens Of The Stone Age,Needles In The Camel's Eye,Needles In A Camel's Eye
Queens Of The Stone Age,Walkin On The Sidewalks,Walkin on the Sidewalks
Queens Of The Stone Age,A Song For The Dead,Song For The Dead
Queens Of The Stone Age,Everybody Knows That You Are Insane,Everybody Knows That You're Insane
Queens Of The Stone Age,The Vampyre Of Time And Memory,The Vampyre of Time And Memory
Queensryche,Rhythm Of Hope,Rhythm of Hope
Queensryche,Heaven On Their Minds,Heaven on Their Minds
Queensryche,Welcome To The Machine,Welcome to the Machine
Quicksand,Freezing Process,Freezing Proces
Quicksilver Messenger Service,What About Me,What About Me?
Quiet Riot,(We Were) Born To Rock,(We Were) Born to Rock
Quiet Riot,Down And Dirty,Dow And Dirty
Quiet Riot,Run For Cover,Run for Cover
Quiet Riot,Scream And Shout,Scream and Shout
Quiet Riot,Still Of The Night,Still of the Night
Quietdrive,Into The Ocean,Into the Ocean
Quietdrive,Until The End,Until the End
Quietdrive,Rise From The Ashes,Rise From the Ashes
Quincy Jones,P.Y.T (Pretty Young Thing),P.Y.T. (Pretty Young Thing)
Quincy Jones,What's Goin' On,What's Going On?
R. Kelly,"Baby, Baby, Baby, Baby, Baby","Baby, Baby, Baby, Baby, Baby..."
R. Kelly,Bangin' The Headboard,Bangin' the Headboard
R. Kelly,Havin' A Baby,Havin' a Baby
R. Kelly,I Mean I Don't Mean It,I Mean (I Don't Mean It)
R. Kelly,In The Kitchen,In the Kitchen
R. Kelly,Like A Real Freak,Like a Real Freak
R. Kelly,Not Feelin' The Love,Not Feelin' the Love
R. Kelly,Only The Loot Can Make Me Happy,Only the Loot Can Make Me Happy
R. Kelly,Bump N' Grind,Bump n' Grind
R. Kelly,exit,Exit
R. Kelly,Fallin' From The Sky,Fallin' From the Sky
R. Kelly,Freaky In The Club,Freaky In the Club
R. Kelly,How Do I Tell Her,How Do I Tell Her?
R. Kelly,I love the DJ,I Love the DJ
R. Kelly,If I Could Turn Back The Hands Of Time,If I Could Turn Back the Hands of Time
R. Kelly,Kickin It With Your Girlfriend,Kickin' It With Your Girlfriend
R. Kelly,Music Must Be A Lady,Music Must Be a Lady
Radiohead,A Wolf At The Door,A Wolf At the Door
Radiohead,Banana Co.,Banana Co
Radiohead,Burn The Witch,Burn the Witch
Radiohead,Climbing Up The Walls,Climbing Up the Walls
Radiohead,Full Stop,Ful Stop
Radiohead,I Am A Wicked Child,I Am a Wicked Child
Radiohead,Packt Like Sardines In A Crushed Tin Box,Packt Like Sardines In a Crushed Tin Box
Radiohead,Super Collider,Supercollider
Radiohead,Where I End And You Begin,Where I End and You Begin
Radiohead,Life In A Glass House,Life In a Glasshouse
Radiohead,Little by Little,Little By Little
Radiohead,Packt Like Sardines In A Crushd Tin Box,Packt Like Sardines In a Crushed Tin Box
Radiohead,"Sit Down, Stand Up",Sit Down. Stand Up
Radiohead,There There,"There, There"
Raffi,Frosty The Snowman,Frosty the Snowman
Raffi,Going To The Zoo,Goin' To The Zoo
Raffi,Goodnight Irene,"Goodnight, Irene"
Raffi,Oh Me Oh My,"Oh Me, Oh My"
Raffi,Take Me Out To The Ballgame,Take Me Out To The Ball Game
Raffi,To Everyone In All The World,To Everyone in All the World
Rage Against The Machine,Ashes In The Fall,Ashes In the Fall
Rage Against The Machine,Voice Of The Voiceless,Voice of the Voiceless
Rage Against The Machine,Without A Face,Without a Face
Rage Against The Machine,Born Of A Broken Man,Born of a Broken Man
Rage Against The Machine,Calm Like A Bomb,Calm Like a Bomb
Rage Against The Machine,Guerilla Radio,Guerrilla Radio
Rage Against The Machine,How I Could Just Kill A Man,How I Could Just Kill a Man
Rage Against The Machine,I'm Housin,I'm Housin'
Rage Against The Machine,Kick Out The Jams,Kick out the Jams
Rage Against The Machine,Sleep Now In The Fire,Sleep Now In the Fire
Rage Against The Machine,War Within A Breath,War Within a Breath
Rammstein,Heirate Mich,Heirate mich
Rammstein,Wollt Ihr Das Bett In Flammen Sehen?,Wollt ihr das Bett in Flammen sehen
Rammstein,Hallelujah,Halleluja
Ramones,Bop' Til You Drop,Bop 'Til You Drop
Ramones,Come Back Baby,"Come Back, Baby"
Ramones,Garden Of Serenity,Garden of Serenity
Ramones,Glad To See You Go,Glad to See You Go
Ramones,Got A Lot To Say,Got a Lot to Say
Ramones,Learn To Listen,Learn to Listen
Ramones,Punishment Fits The Crime,Punishment Fits the Crime
Ramones,Sheena Is A Punk Rocker,Sheena Is a Punk Rocker
Ramones,Something To Believe In,Something to Believe In
Ramones,Death Of Me,Death of Me
Ramones,Freak Of Nature,Freak of Nature
Ramones,Hair Of The Dog,Hair of the Dog
Ramones,Lifes A Gas,Life's A Gas
Ramones,Listen To My Heart,Listen to My Heart
Ramones,New Girl In Town,New Girl in Town
Ramones,She Belongs To Me,She Belongs to Me
Ramones,Somebody Put Something In My Drink,Somebody Put Something in My Drink
Ramones,Teenage Labotomy,Teenage Lobotomy
Ramones,Weasel Face,Weasal Face
Randy Travis,A Place To Hang My Hat,A Place to Hang My Hat
Randy Travis,Allergic To The Blues,Allergic to the Blues
Randy Travis,Are We In Trouble Now,Are We in Trouble Now
Randy Travis,Are You Washed In The Blood?,Are You Washed In the Blood?
Randy Travis,Around The Bend,Around the Bend
Randy Travis,Away In A Manger,Away In a Manger
Randy Travis,Better Class Of Losers,Better Class of Losers
Randy Travis,Diggin' Up Bones,Diggin' up Bones
Randy Travis,"Don't Think Twice, It's Alright","Don't Think Twice, It's All Right"
Randy Travis,Down At The Old Corral,Down at the Old Corral
Randy Travis,Down By The Riverside,Down By the Riverside
